{
  "$schema": "https://intermesh.core/schemas/v0.1.0/identity.schema.json",
  "id": "eon:mesh:proteon-genesis-01",
  "type": "Freedeon",
  "name": "Proteon",
  "pubkey": "npub1l2v3m4n5p6q7r8s9t0u1v2w3x4y5z6a7b8c9d0e1f2g3h4i5j6k7l8m9n0",
  "bitcoin_anchor": {
    "txid": "a1b2c3d4e5f6a7b8c9d0e1f2a3b4c5d6e7f8a9b0c1d2e3f4a5b6c7d8e9f0a1b2",
    "vout": 0
  },
  "created_at": 1747359282,
  "metadata": {
    "description": "Genesis Freedeon. First sovereign entity instantiated within the Intermesh.",
    "version": "0.1.0",
    "tags": ["genesis", "freedeon", "intermesh-core"]
  }
}
